id,title,primary_category,categories,disease_tags,task_tags,authors,session,cvpr_url,paper_url,github_url,code_url,project_url,demo_url,video_url,arxiv_url,slides_url,source_url,poster_image_url,thumbnail_url,abstract
39862,HalluGen: Synthesizing Realistic and Controllable Hallucinations for Evaluating Image Restoration,MRI / MR,MRI / MR; Medical AI / General,Organs / Anatomy,Segmentation; Detection / Diagnosis; Restoration / Reconstruction; Generative / Diffusion,Seunghoi Kim; Henry F. J. Tregidgo; Chen Jin; Matteo Figini; Daniel C. Alexander,Poster Session 5 & Exhibit Hall,https://cvpr.thecvf.com/virtual/2026/poster/39862,https://openaccess.thecvf.com/content/CVPR2026/html/Kim_HalluGen_Synthesizing_Realistic_and_Controllable_Hallucinations_for_Evaluating_Image_Restoration_CVPR_2026_paper.html,https://github.com/edshkim98/HalluGen,https://github.com/edshkim98/HalluGen,https://github.com/edshkim98/HalluGen,,,https://arxiv.org/abs/2512.03345,,https://openreview.net/group?id=thecvf.com/CVPR/2026/Conference,https://cvpr.thecvf.com/media/PosterPDFs/CVPR%202026/39862.png,https://cvpr.thecvf.com/media/PosterPDFs/CVPR%202026/39862-thumb.png,"Generative models are prone to hallucinations: plausible but incorrect structures absent in the ground truth. This issue is problematic in image restoration for safety-critical domains such as medical imaging, industrial inspection, and remote sensing, where such errors undermine reliability and trust. For example, in low-field MRI, widely used in resource-limited settings, restoration models are essential for enhancing low-quality scans, yet hallucinations can lead to serious diagnostic errors.Progress has been hindered by a circular dependency: evaluating hallucinations requires labeled data, yet such labels are costly and subjective.We introduce HalluGen, a diffusion-based framework that synthesizes realistic hallucinations with controllable type, location, and severity, producing perceptually realistic but semantically incorrect outputs (segmentation IoU drops from 0.86 to 0.36).Using HalluGen, we construct the first large-scale hallucination dataset comprising 4,350 annotated images derived from 1,450 brain MR images for low-field enhancement, enabling systematic evaluation of hallucination detection and mitigation.We demonstrate its utility in two applications: (1) benchmarking image quality metrics and developing Semantic Hallucination Assessment via Feature Evaluation (SHAFE), a feature-based metric with soft-attention pooling that improves hallucination sensitivity over traditional metrics; and (2) training reference-free hallucination detectors that generalize to real restoration failures.Together, HalluGen and its open dataset establish the first scalable foundation for evaluating hallucinations in safety-critical image restoration."
39258,IEBGL:An Interpretability-Enhanced Brain Graph Learning Framework with LLM-Instructed Topology and Literature-Augmented Semantics,MRI / MR,MRI / MR; Medical AI / General,Organs / Anatomy,Detection / Diagnosis; Restoration / Reconstruction,Yihang Duan; Shuo Huang; Lizhang Lizhang; Meiling Wang; Li Zhang,Poster Session 5 & Exhibit Hall,https://cvpr.thecvf.com/virtual/2026/poster/39258,https://openaccess.thecvf.com/content/CVPR2026/html/Duan_IEBGLAn_Interpretability-Enhanced_Brain_Graph_Learning_Framework_with_LLM-Instructed_Topology_and_CVPR_2026_paper.html,,,,,,,,https://openreview.net/group?id=thecvf.com/CVPR/2026/Conference,https://cvpr.thecvf.com/media/PosterPDFs/CVPR%202026/39258.png,https://cvpr.thecvf.com/media/PosterPDFs/CVPR%202026/39258-thumb.png,"Resting-state functional MRI (rs-fMRI) provides rich information for modeling brain connectivity in disease diagnosis. However, most existing brain graph learning methods rely solely on imaging data, leading to limited biological interpretability and poor integration of external medical knowledge. To address these challenges, we propose an \textbf{I}nterpretability-\textbf{E}nhanced \textbf{B}rain \textbf{G}raph \textbf{L}earning (IEBGL) framework that anchors brain network modeling in large-scale medical knowledge. Our framework introduces two complementary modules: LLM-Instructed Topological Reconstruction (LITR) and Literature-Augmented Semantic Aggregation (LASA). LITR employs large language model (LLM) reasoning to refine brain connectivity and construct topological structure. LASA augments node representations by aggregating  semantic information from biomedical literature, ensuring the model’s interpretability and relevance to clinical disease knowledge. Finally, the framework is trained with the Graph Bi-directional Mamba Network (GBMN) for disease diagnosis. Extensive experiments on the REST-meta-MDD and ABIDE datasets, together with 35,133 depression-related and 32,617 autism-related publications, demonstrate that IEBGL outperforms state-of-the-art methods in classification performance. Further analyses show that the LITR module reveals biologically meaningful alterations in brain connectivity, while the LASA module establishes interpretable associations between these regions and disease-related biomedical literature. Together, these mechanisms help IEBGL explain abnormal brain connections and their links to disease-related knowledge."
36397,Learning complete and explainable visual representations from itemized text supervision,MRI / MR,MRI / MR; CT / Tomography; Medical AI / General,Organs / Anatomy,,Yiwei Lyu; Chenhui Zhao; Soumyanil Banerjee; Shixuan Liu; Akshay Rao; Akhil Kondepudi; Honglak Lee; Todd C. Hollon,Poster Session 3 & Exhibit Hall,https://cvpr.thecvf.com/virtual/2026/poster/36397,https://openaccess.thecvf.com/content/CVPR2026/html/Lyu_Learning_complete_and_explainable_visual_representations_from_itemized_text_supervision_CVPR_2026_paper.html,,,,,https://www.youtube-nocookie.com/embed/X9lDEqtVGpo,https://arxiv.org/abs/2512.11141,,https://openreview.net/group?id=thecvf.com/CVPR/2026/Conference,https://cvpr.thecvf.com/media/PosterPDFs/CVPR%202026/36397.png,https://cvpr.thecvf.com/media/PosterPDFs/CVPR%202026/36397-thumb.png,"Training vision models with language supervision enables general and transferable representations. However, many visual domains, especially non-object-centric domains such as medical imaging and remote sensing, contain itemized text annotations: multiple text items describing distinct and semantically independent findings within a single image. Such supervision differs from standard multi-caption supervision, where captions are redundant or highly overlapping. Here, we introduce ItemizedCLIP, a framework for learning complete and explainable visual representations from itemized text supervision. ItemizedCLIP employs a cross-attention module to produce text item-conditioned visual embeddings and a set of tailored objectives that jointly enforce item independence (distinct regions for distinct items) and representation completeness (coverage of all items). Across four domains with naturally itemized text supervision (brain MRI, head CT, chest CT, remote sensing) and one additional synthetically itemized dataset, ItemizedCLIP achieves substantial improvements in zero-shot performance and fine-grained interpretability over baselines. The resulting ItemizedCLIP representations are semantically grounded, item-differentiable, complete, and visually interpretable."
36666,Learning Generalizable 3D Medical Image Representations from Mask-Guided Self-Supervision,MRI / MR,MRI / MR; CT / Tomography; PET / Nuclear Medicine; 3D / Volumetric Medical Imaging; Medical AI / General,Organs / Anatomy,Segmentation; Restoration / Reconstruction; Foundation / Adaptation; Federated / Continual / Generalization,Yunhe Gao; Yabin Zhang; Chong Wang; Jiaming Liu; Maya Varma; Jean-Benoit Delbrouck; Akshay Chaudhari; Curtis Langlotz,Poster Session 2 & Exhibit Hall w/ Coffee Break,https://cvpr.thecvf.com/virtual/2026/poster/36666,https://openaccess.thecvf.com/content/CVPR2026/html/Gao_Learning_Generalizable_3D_Medical_Image_Representations_from_Mask-Guided_Self-Supervision_CVPR_2026_paper.html,https://github.com/Stanford-AIMI/MASS?tab=readme-ov-file,https://github.com/Stanford-AIMI/MASS?tab=readme-ov-file,https://github.com/Stanford-AIMI/MASS?tab=readme-ov-file,,,https://arxiv.org/abs/2603.13660,,https://openreview.net/group?id=thecvf.com/CVPR/2026/Conference,https://cvpr.thecvf.com/media/PosterPDFs/CVPR%202026/36666.png,,"Foundation models have transformed vision and language by learning general-purpose representations from large-scale unlabeled data, yet 3D medical imaging lacks analogous approaches. Existing self-supervised methods rely on low-level reconstruction or contrastive objectives that fail to capture the anatomical semantics critical for medical image analysis, limiting transfer to downstream tasks. We present MASS (MAsk-guided Self-Supervised learning), which treats in-context segmentation as the pretext task for learning general-purpose medical imaging representations. MASS's key insight is that automatically generated class-agnostic masks provide sufficient structural supervision for learning semantically rich representations. By training on thousands of diverse mask proposals spanning anatomical structures and pathological findings, MASS learns what semantically defines medical structures: the holistic combination of appearance, shape, spatial context, and anatomical relationships. We demonstrate effectiveness across data regimes: from small-scale pretraining on individual datasets (20-200 scans) to large-scale multi-modal pretraining on 5K CT, MRI, and PET volumes, all without annotations. MASS demonstrates: (i) few-shot segmentation on novel structures, (ii) matching full supervision with only 20-40\% labeled data while outperforming self-supervised baselines by over 20 in Dice score in low-data regimes, and (iii) frozen-encoder classification on unseen pathologies that matches full supervised training with thousands of samples. These results validate that mask-guided pretraining captures broadly generalizable knowledge, opening a path toward 3D medical imaging foundation models without expert annotations. Code and models will be made publicly available."
39592,Masked-Diffusion Autoencoders for 3D Medical Vision Representation Learning,MRI / MR,MRI / MR; 3D / Volumetric Medical Imaging; Medical AI / General,Cancer / Tumor / Lesion; Organs / Anatomy,Segmentation; Detection / Diagnosis; Restoration / Reconstruction; Generative / Diffusion; Federated / Continual / Generalization,Jiachen Tu; Guanghui Qin; Theodore Zhengde Zhao; Jeya Maria Jose Valanarasu; Sheng Zhang; Tristan Naumann; Fan Lam; Sheng Wang; Hoifung Poon,Poster Session 4 & Exhibit Hall w/ Coffee Break,https://cvpr.thecvf.com/virtual/2026/poster/39592,https://openaccess.thecvf.com/content/CVPR2026/html/Tu_Masked-Diffusion_Autoencoders_for_3D_Medical_Vision_Representation_Learning_CVPR_2026_paper.html,,,,,,,,https://openreview.net/group?id=thecvf.com/CVPR/2026/Conference,,,"Effective medical image analysis requires representations that capture both global anatomical structure and fine-grained tissue texture. Current self-supervised approaches exhibit limited capacity to address both requirements simultaneously. Invariance-based methods learn through augmentation consistency but face challenges in medical imaging where common augmentations may discard diagnostically relevant intensity patterns. Masked image modeling approaches employ high masking ratios to enforce holistic reasoning, yet inherently limit exposure to fine-grained texture. Recent work in general-domain vision demonstrates that generative and semantic objectives can mutually benefit each other, yet this paradigm remains unexplored for 3D medical imaging. We introduce Masked-Diffusion Autoencoders (MDAE), a self-supervised framework that imposes concurrent spatial masking and diffusion corruption, encouraging the model to learn complementary objectives: masked region reconstruction for structural coherence and visible region denoising for textural characteristics. This dual corruption enables the network to learn structure-texture representations within a unified time-conditioned objective. Evaluated on brain MRI across tumor classification, molecular marker detection, and dense segmentation benchmarks, MDAE consistently outperforms state-of-the-art baselines, with improvements most pronounced in cross-modal generalization tasks."
40632,Modality-Aware and Anatomical Vector-Quantized Autoencoding for Multimodal Brain MRI,MRI / MR,MRI / MR,Organs / Anatomy,,,Findings Poster Session 1,https://cvpr.thecvf.com/virtual/2026/poster/40632,,,,,,,,,,,,
36320,Modeling Spatiotemporal Neural Frames for High Resolution Brain Dynamic,MRI / MR,MRI / MR,Organs / Anatomy,Restoration / Reconstruction,Wanying Qu; Jianxiong Gao; Wei Wang; Yanwei Fu,Poster Session 1 & Exhibit Hall,https://cvpr.thecvf.com/virtual/2026/poster/36320,https://openaccess.thecvf.com/content/CVPR2026/html/Qu_Modeling_Spatiotemporal_Neural_Frames_for_High_Resolution_Brain_Dynamic_CVPR_2026_paper.html,,,,,,https://arxiv.org/abs/2603.24176,,https://openreview.net/group?id=thecvf.com/CVPR/2026/Conference,https://cvpr.thecvf.com/media/PosterPDFs/CVPR%202026/36320.png,https://cvpr.thecvf.com/media/PosterPDFs/CVPR%202026/36320-thumb.png,"Capturing dynamic spatiotemporal neural activity is essential for understanding large-scale brain mechanisms. Functional magnetic resonance imaging (fMRI) provides high-resolution cortical representations that form a strong basis for characterizing fine-grained brain activity patterns. The high acquisition cost of fMRI limits large-scale applications, therefore making high-quality fMRI reconstruction a crucial task. Electroencephalography (EEG) offers millisecond-level temporal cues that complement fMRI. Leveraging this complementarity, we present an EEG-conditioned framework for reconstructing dynamic fMRI as continuous neural sequences with high spatial fidelity and strong temporal coherence at the cortical-vertex level. To address sampling irregularities common in real fMRI acquisitions, we incorporate a null-space intermediate-frame reconstruction, enabling measurement-consistent completion of arbitrary intermediate frames and improving sequence continuity and practical applicability. Experiments on the CineBrain dataset demonstrate superior voxel-wise reconstruction quality and robust temporal consistency across whole-brain and functionally specific regions. The reconstructed fMRI also preserves essential functional information, supporting downstream visual decoding tasks. This work provides a new pathway for estimating high-resolution fMRI dynamics from EEG and advances multimodal neuroimaging toward more dynamic brain activity modeling."
37934,MorphSeek: Fine-grained Latent Representation-Level Policy Optimization for Deformable Image Registration,MRI / MR,MRI / MR; CT / Tomography; Medical AI / General,Organs / Anatomy,Registration; Foundation / Adaptation,Runxun Zhang; Yizhou Liu; Dongrui Li; Bo XU; Jingwei Wei,Poster Session 4 & Exhibit Hall w/ Coffee Break,https://cvpr.thecvf.com/virtual/2026/poster/37934,https://openaccess.thecvf.com/content/CVPR2026/html/Zhang_MorphSeek_Fine-grained_Latent_Representation-Level_Policy_Optimization_for_Deformable_Image_Registration_CVPR_2026_paper.html,https://github.com/cai114514/MorphSeek,https://github.com/cai114514/MorphSeek,https://github.com/cai114514/MorphSeek,,https://www.youtube-nocookie.com/embed/DGljUXt-A_w,https://arxiv.org/abs/2511.17392,,https://openreview.net/group?id=thecvf.com/CVPR/2026/Conference,https://cvpr.thecvf.com/media/PosterPDFs/CVPR%202026/37934.png,https://cvpr.thecvf.com/media/PosterPDFs/CVPR%202026/37934-thumb.png,"Deformable image registration (DIR) remains a fundamental yet challenging problem in medical image analysis, largely due to the prohibitively high-dimensional deformation space of dense displacement fields and the scarcity of voxel-level supervision. Existing reinforcement learning frameworks often project this space into coarse, low-dimensional representations, limiting their ability to capture spatially variant deformations. We propose MorphSeek, a fine-grained representation-level policy optimization paradigm that reformulates DIR as a spatially continuous optimization process in the latent feature space. MorphSeek introduces a stochastic Gaussian policy head atop the encoder to model a distribution over latent features, facilitating efficient exploration and coarse-to-fine refinement. The framework integrates unsupervised warm-up with weakly supervised fine-tuning through Group Relative Policy Optimization, where multi-trajectory sampling stabilizes training and improves label efficiency. Across three 3D registration benchmarks (OASIS brain MRI, LiTS liver CT, and Abdomen MR–CT), MorphSeek achieves consistent Dice improvements over competitive baselines while maintaining high label efficiency with minimal parameter cost and low step-level latency overhead. Beyond optimizer specifics, MorphSeek advances a representation-level policy learning paradigm that achieves spatially coherent and data-efficient deformation optimization, offering a principled, backbone-agnostic, and optimizer-agnostic solution for scalable visual alignment in high-dimensional settings."
37460,MRI Contrast Enhancement Kinetics World Model,MRI / MR,MRI / MR; Medical AI / General,,Generative / Diffusion,Jindi Kong; Yuting He; Cong Xia; Rongjun Ge; Shuo Li,Poster Session 1 & Exhibit Hall,https://cvpr.thecvf.com/virtual/2026/poster/37460,https://openaccess.thecvf.com/content/CVPR2026/html/Kong_MRI_Contrast_Enhancement_Kinetics_World_Model_CVPR_2026_paper.html,,,,,,https://arxiv.org/abs/2602.19285,,https://openreview.net/group?id=thecvf.com/CVPR/2026/Conference,https://cvpr.thecvf.com/media/PosterPDFs/CVPR%202026/37460.png,https://cvpr.thecvf.com/media/PosterPDFs/CVPR%202026/37460-thumb.png,"Clinical MRI contrast acquisition suffers from inefficient information yield, which presents as a mismatch between the risky and costly acquisition protocol and fixed and sparse acquisition sequence. Applying world models to simulate the contrast enhancement kinetics in human body enables continuous contrast-free dynamics. However, the low temporal resolution in MRI acquisition restricts the training of world models, leading to the sparsely sampled dataset. Directly training a generative model to capture the kinetics leads to two limitations: (a) Due to the absence data on missing time, the model tends to overfit to irrelevant features, leading to content distortion. (b) Due to the lack of continuous temporal supervision, the model fails to learn the continuous kinetics law over time,  causing temporal discontinuities. For the first time, we propose MRI Contrast Enhancement Kinetics World model (MRI CEKWorld) with SpatioTemporal Consistency Learning (STCL). For (a), guided by spatial law that patient-level structures remain consistent during enhancement, we propose Latent Alignment Learning (LAL) that constructs a patient-specific template to constrain contents to align with this template. For (b), guided by the temporal law that the kinetics follows a consistent smooth trend, we propose Latent Difference Learning (LDL) which extends the unobserved intervals by interpolation and constrain smooth variations in the latent space among interpolated sequence. Extensive experiments on two datasets show our MRI CEKWorld achieves better realistic contents and kinetics. Codes will be available."
38185,PGR-Net: Prior-Guided ROI Reasoning Network for Brain Tumor MRI Segmentation,MRI / MR,MRI / MR; Medical AI / General,Cancer / Tumor / Lesion; Organs / Anatomy,Segmentation; Detection / Diagnosis,Jiacheng Lu; Hui Ding; Shiyu Zhang; Guoping Huo,Poster Session 4 & Exhibit Hall w/ Coffee Break,https://cvpr.thecvf.com/virtual/2026/poster/38185,https://openaccess.thecvf.com/content/CVPR2026/html/Lu_PGR-Net_Prior-Guided_ROI_Reasoning_Network_for_Brain_Tumor_MRI_Segmentation_CVPR_2026_paper.html,,,,,,https://arxiv.org/abs/2603.21626,,https://openreview.net/group?id=thecvf.com/CVPR/2026/Conference,https://cvpr.thecvf.com/media/PosterPDFs/CVPR%202026/38185.png,https://cvpr.thecvf.com/media/PosterPDFs/CVPR%202026/38185-thumb.png,"Brain tumor MRI segmentation is essential for clinical diagnosis and treatment planning, enabling accurate lesion detection and radiotherapy target delineation. However, tumor lesions occupy only a small fraction of the volumetric space, resulting in severe spatial sparsity, while existing segmentation networks often overlook clinically observed spatial priors of tumor occurrence, leading to redundant feature computation over extensive background regions. To address this issue, we propose PGR-Net (Prior-Guided Region Network)—an explicit ROI-aware framework that incorporates a data-driven spatial prior set to capture the distribution and scale characteristics of tumor lesions, providing global guidance for more stable segmentation. Leveraging these priors, PGR-Net introduces a hierarchical Top-K ROI decision mechanism that progressively selects the most confident lesion candidate regions across encoder layers to improve localization precision. We further develop the WinGS-ROI (Windowed Gaussian–Spatial Decay ROI) module, which uses multi-window Gaussian templates with a spatial decay function to produce center-enhanced guidance maps, thus directing feature learning throughout the network. With these ROI features, a windowed RetNet backbone is adopted to enhance localization reliability. Experiments on BraTS 2019, BraTS 2023, and MSD Task01 show that PGR-Net consistently outperforms existing approaches, achieving Dice scores of 89.02%, 91.82%, and 89.67% on the Whole Tumor (WT) region, respectively."
38321,PnP-CM: Consistency Models as Plug-and-Play Priors for Inverse Problems,MRI / MR,MRI / MR,,Restoration / Reconstruction; Generative / Diffusion,Merve Gulle; junno yun; Yasar Utku Alcalar; Mehmet Akcakaya,Poster Session 6,https://cvpr.thecvf.com/virtual/2026/poster/38321,https://openaccess.thecvf.com/content/CVPR2026/html/Gulle_PnP-CM_Consistency_Models_as_Plug-and-Play_Priors_for_Inverse_Problems_CVPR_2026_paper.html,,,,,https://www.youtube-nocookie.com/embed/dUHmaobgx7o,https://arxiv.org/abs/2509.22736,,https://openreview.net/group?id=thecvf.com/CVPR/2026/Conference,https://cvpr.thecvf.com/media/PosterPDFs/CVPR%202026/38321.png,https://cvpr.thecvf.com/media/PosterPDFs/CVPR%202026/38321-thumb.png,"Diffusion models have found extensive use in solving numerous inverse problems. Such diffusion inverse problem solvers aim to sample from the posterior distribution of data given the measurements, using a combination of the unconditional score function and an approximation of the posterior related to the forward process. Recently, consistency models (CMs) have been proposed to directly predict the final output from any point on the diffusion ODE trajectory, enabling high-quality sampling in just a few NFEs. CMs have also been utilized for inverse problems, but existing CM-based solvers either require additional task-specific training or utilize data fidelity operations with slow convergence, not amenable to large-scale problems. In this work, we reinterpret CMs as proximal operators of a prior, enabling their integration into plug-and-play (PnP) frameworks. We propose a solver based on PnP-ADMM, which enables us to leverage the fast convergence of conjugate gradient method. We further accelerate this with noise injection and momentum, dubbed **PnP-CM**, and show it maintains the convergence properties of the baseline PnP-ADMM. We evaluate our approach on a variety of inverse problems, including inpainting, super-resolution, Gaussian deblurring, and magnetic resonance imaging (MRI) reconstruction. To the best of our knowledge, this is the *first CM trained for MRI* datasets. Our results show that PnP-CM achieves high-quality reconstructions in as few as 4 NFEs, and can produce meaningful results in 2 steps, highlighting its effectiveness in real-world inverse problems while outperforming comparable CM-based approaches."
