id,title,primary_category,categories,disease_tags,task_tags,authors,session,cvpr_url,paper_url,github_url,code_url,project_url,demo_url,video_url,arxiv_url,slides_url,source_url,poster_image_url,thumbnail_url,abstract
39370,PMRNet: Physics-informed Multi-scale Refinement Network for Medical Image Segmentation,Medical AI / General,Medical AI / General,,Segmentation; Detection / Diagnosis; Generative / Diffusion,Boce Kang,Poster Session 3 & Exhibit Hall,https://cvpr.thecvf.com/virtual/2026/poster/39370,https://openaccess.thecvf.com/content/CVPR2026/html/Kang_PMRNet_Physics-informed_Multi-scale_Refinement_Network_for_Medical_Image_Segmentation_CVPR_2026_paper.html,https://github.com/KangBoce/PMRNet,https://github.com/KangBoce/PMRNet,https://github.com/KangBoce/PMRNet,,https://www.youtube-nocookie.com/embed/oTDjNM_rgaQ,,https://cvpr.thecvf.com/media/cvpr-2026/Slides/39370.pdf,https://openreview.net/group?id=thecvf.com/CVPR/2026/Conference,https://cvpr.thecvf.com/media/PosterPDFs/CVPR%202026/39370.png,https://cvpr.thecvf.com/media/PosterPDFs/CVPR%202026/39370-thumb.png,"Medical image segmentation demands both high accuracy and computational efficiency, yet existing methods face a critical trade-off: CNNs lack global context while transformers incur prohibitive costs for deployment on resource-constrained devices. To address this challenge, we propose $P$hysics-informed $M$ulti-scale $R$efinement Network (PMRNet), integrating symplectic geometry, renormalization group theory, and entropy diffusion to guide feature learning. PMRNet features three innovations: (1) a physics-informed encoder with Enhanced Symplectic Convolution for boundary detection and Renormalization Group-informed Downsampling for information preservation; (2) a Pseudo-Global Receptive Field module achieving near-global context with linear complexity through entropy-driven diffusion; and (3) a boundary-aware decoder for precise delineation. With only $0.87$M parameters and $3.43$ GFLOPs, PMRNet achieves $87.25\%$ IoU and $92.56\%$ Dice on the challenging Clinic dataset, outperforming state-of-the-art (SOTA) models with even $100\times$ more parameters across $12$ medical imaging datasets while maintaining computational efficiency."
38409,R^2-Seg: Training-Free OOD Medical Tumor Segmentation via Anatomical Reasoning and Statistical Rejection,Medical AI / General,Medical AI / General,Cancer / Tumor / Lesion; Organs / Anatomy,Segmentation; Foundation / Adaptation; Federated / Continual / Generalization,Shuaike Shen; Ke Liu; Jiaqing Xie; Shangde Gao; Chunhua Shen; Ge Liu; Mireia Crispin-Ortuzar; Shangqi Gao,Poster Session 4 & Exhibit Hall w/ Coffee Break,https://cvpr.thecvf.com/virtual/2026/poster/38409,https://openaccess.thecvf.com/content/CVPR2026/html/Shen_R2-Seg_Training-Free_OOD_Medical_Tumor_Segmentation_via_Anatomical_Reasoning_and_CVPR_2026_paper.html,,,https://eurekashen.github.io/R2Seg/,,https://www.youtube-nocookie.com/embed/rCS9Szgzdfk,,,https://openreview.net/group?id=thecvf.com/CVPR/2026/Conference,https://cvpr.thecvf.com/media/PosterPDFs/CVPR%202026/38409.png,https://cvpr.thecvf.com/media/PosterPDFs/CVPR%202026/38409-thumb.png,"Foundation models for medical image segmentation struggle under out-of-distribution (OOD) shifts, often producing fragmented false positives on OOD tumors. We introduce **R$^2$-Seg**, a **training-free** framework for robust OOD tumor segmentation that operates via a two-stage **Reason-and-Reject** process. First, the **Reason** step employs an LLM-guided anatomical reasoning planner to localize organ anchors and generate multi-scale ROIs. Second, the **Reject** step applies two-sample statistical testing to candidates generated by a frozen foundation model (BiomedParse) within these ROIs. This statistical rejection filter retains only candidates significantly different from normal tissue, effectively suppressing false positives. Our framework requires no parameter updates, making it compatible with zero-update test-time augmentation and avoiding catastrophic forgetting. On multi-center and multi-modal tumor segmentation benchmarks, **R$^2$-Seg** substantially improves Dice, specificity, and sensitivity over strong baselines and the original foundation models."
38820,Rethinking Box Supervision: Bias-Free Weakly Supervised Medical Segmentation,Medical AI / General,Medical AI / General,,Segmentation,Jun Wei; Hui Huang,Poster Session 2 & Exhibit Hall w/ Coffee Break,https://cvpr.thecvf.com/virtual/2026/poster/38820,https://openaccess.thecvf.com/content/CVPR2026/html/Wei_Rethinking_Box_Supervision_Bias-Free_Weakly_Supervised_Medical_Segmentation_CVPR_2026_paper.html,,,,,,,,https://openreview.net/group?id=thecvf.com/CVPR/2026/Conference,https://cvpr.thecvf.com/media/PosterPDFs/CVPR%202026/38820.png,https://cvpr.thecvf.com/media/PosterPDFs/CVPR%202026/38820-thumb.png,"Pixel-level annotations for medical image segmentation are costly and labor-intensive, often requiring expert knowledge. Bounding box labels provide a more scalable alternative but introduce strong box-shaped bias that hampers segmentation quality. We propose WeakMed, a general-purpose weakly supervised segmentation framework that removes the dependence on pixel-level masks while overcoming the structural limitations of box supervision. WeakMed introduces two lightweight, plug-and-play training components: (1) a Mask-to-Box (M2B) transformation that aligns predicted masks with box annotations to reduce label mismatch and box-induced bias, and (2) a Scale Consistency (SC) loss that enforces multi-scale self-supervision to address the ambiguity and instability of weak labels. Both modules are used only during training and impose no inference overhead. Across 9 segmentation tasks, 10 datasets, and 6 imaging modalities, WeakMed consistently surpasses existing weakly supervised methods and achieves performance competitive with fully supervised baselines. These results demonstrate its practicality as a low-cost yet high-quality solution for medical image segmentation. Codes will be released."
39405,RNED: Rotary Number Encoding and Decoding for Quantitative Medical VLM Analysis,Medical AI / General,Medical AI / General,Cancer / Tumor / Lesion,Medical VLM / VQA / Reasoning; Federated / Continual / Generalization,Fengbei Liu; Sunwoo Kwak; Nusrat Binta Nizam; Ilan Richter; Ashley Beecy; Jayant Raikhelkar; Deborah Estrin; Mert Sabuncu,Poster Session 2 & Exhibit Hall w/ Coffee Break,https://cvpr.thecvf.com/virtual/2026/poster/39405,https://openaccess.thecvf.com/content/CVPR2026/html/Liu_RNED_Rotary_Number_Encoding_and_Decoding_for_Medical_VLMs_CVPR_2026_paper.html,,,,,,,,https://openreview.net/group?id=thecvf.com/CVPR/2026/Conference,,,"Vision-Language Models (VLMs) are increasingly adopted for medical applications, but their clinical utility is limited by a core weakness in quantitative reasoning. This limitation affects tasks ranging from regression of lesion sizes to prediction of bounding-box coordinates and stems from the discrete tokenization schemes underlying Large Language Models (LLMs). To address this, we propose \emph{Rotary Number Encoding and Decoding} (RNED), a principled method for embedding continuous numerical values directly in the representation space of a VLM. Analogous to rotary position encoding, RNED represents a scalar by applying a number-specific rotation matrix to a dedicated numeric token embedding. This norm-preserving transformation maintains ordinal structure over a wide numerical range and integrates seamlessly with pretrained model weights. For decoding, we introduce a robust score-matching–based scheme to recover continuous values from hidden states in the presence of stochastic noise. We evaluate RNED on two quantitative tasks: radiological measurement estimation and medical visual grounding. On both internal and public benchmarks, RNED consistently outperforms existing VLM baselines. Together, these results show that RNED offers a robust, generalizable solution for numerical reasoning in medical VLMs, enabling models that are both quantitatively reliable and clinically applicable. We will release code for experiments on public datasets."
41072,R²MoE: Representation and Expert Selection Dual-Regularized Mixture-of-Experts for Multimodal Clinical Data,Medical AI / General,Medical AI / General,,,,Findings Poster Session 2,https://cvpr.thecvf.com/virtual/2026/poster/41072,,,,,,,,,,,,
36238,SD-FSMIS: Adapting Stable Diffusion for Few-Shot Medical Image Segmentation,Medical AI / General,Medical AI / General,,Segmentation; Generative / Diffusion; Federated / Continual / Generalization,Meihua Li; Yang Zhang; Weizhao He; Hu Qu; Yisong Li,Poster Session 5 & Exhibit Hall,https://cvpr.thecvf.com/virtual/2026/poster/36238,https://openaccess.thecvf.com/content/CVPR2026/html/Li_SD-FSMIS_Adapting_Stable_Diffusion_for_Few-Shot_Medical_Image_Segmentation_CVPR_2026_paper.html,,,,,,https://arxiv.org/abs/2604.03134,,https://openreview.net/group?id=thecvf.com/CVPR/2026/Conference,https://cvpr.thecvf.com/media/PosterPDFs/CVPR%202026/36238.png,https://cvpr.thecvf.com/media/PosterPDFs/CVPR%202026/36238-thumb.png,"Few-Shot Medical Image Segmentation (FSMIS) aims to segment novel object classes in medical images using only minimal annotated examples, addressing the critical challenges of data scarcity and domain shifts prevalent in medical imaging. While Diffusion Models (DM) excel in visual tasks, their potential for FSMIS remains largely unexplored. We propose that the rich visual priors learned by large-scale DMs offer a powerful foundation for a more robust and data-efficient segmentation approach. In this paper, we introduce SD-FSMIS, a novel framework designed to effectively adapt the powerful pre-trained Stable Diffusion (SD) model for the FSMIS task. Our approach repurposes its conditional generative architecture by introducing two key components: a Support-Query Interaction (SQI) and a Visual-to-Textual Condition Translator (VTCT). Specifically, SQI provides a straightforward yet powerful means of adapting SD to the FSMIS paradigm. The VTCT module translates visual cues from the support set into an implicit textual embedding that guides the diffusion model, enabling precise conditioning of the generation process. Extensive experiments demonstrate that SD-FSMIS achieves competitive results compared to state-of-the-art methods in standard settings. Surprisingly, it also demonstrated excellent generalization ability in more challenging cross-domain scenarios. These findings highlight the immense potential of adapting large-scale generative models to advance data-efficient and robust medical image segmentation."
36392,SegMoTE: Token-Level Mixture of Experts for Medical Image Segmentation,Medical AI / General,Medical AI / General,Organs / Anatomy,Segmentation; Detection / Diagnosis; Foundation / Adaptation; Federated / Continual / Generalization,Yujie Lu; Jingwen Li; Sibo Ju; Yanzhou Su; He Yao; Yisong Liu; Min Zhu; Junlong Cheng,Poster Session 6,https://cvpr.thecvf.com/virtual/2026/poster/36392,https://openaccess.thecvf.com/content/CVPR2026/html/Lu_SegMoTE_Token-Level_Mixture_of_Experts_for_Medical_Image_Segmentation_CVPR_2026_paper.html,,,,,,https://arxiv.org/abs/2602.19213,,https://openreview.net/group?id=thecvf.com/CVPR/2026/Conference,https://cvpr.thecvf.com/media/PosterPDFs/CVPR%202026/36392.png,https://cvpr.thecvf.com/media/PosterPDFs/CVPR%202026/36392-thumb.png,"Medical image segmentation is vital for clinical diagnosis and quantitative analysis, yet remains challenging due to the heterogeneity of imaging modalities and the high cost of pixel-level annotations. Although general interactive segmentation models like SAM have achieved remarkable progress, their transfer to medical imaging still faces two key bottlenecks: (i) the lack of adaptive mechanisms for modality- and anatomy-specific tasks, which limits generalization in out-of-distribution medical scenarios; and (ii) current medical adaptation methods fine-tune on large, heterogeneous datasets without selection, leading to noisy supervision, higher cost, and negative transfer. To address these issues, we propose SegMoTE, an efficient and adaptive framework for medical image segmentation. SegMoTE preserves SAM’s original prompt interface, efficient inference, and zero-shot generalization while introducing only a small number of learnable parameters to dynamically adapt across modalities and tasks. In addition, we design a progressive prompt tokenization mechanism that enables fully automatic segmentation, significantly reducing annotation dependence. Trained on MedSeg-HQ, a curated dataset less than 1% of existing large-scale datasets, SegMoTE achieves SOTA performance across diverse imaging modalities and anatomical tasks. It represents the first efficient, robust, and scalable adaptation of general segmentation models to the medical domain under extremely low annotation cost, advancing the practical deployment of foundation vision models in clinical applications."
36490,SemiGDA: Generative Dual-distribution Alignment for Semi-Supervised Medical Image Segmentation,Medical AI / General,Medical AI / General,,Segmentation; Generative / Diffusion,kaiwen Huang; Yi Zhou; Yizhe Zhang; Jingxiong Li; Tao Zhou,Poster Session 1 & Exhibit Hall,https://cvpr.thecvf.com/virtual/2026/poster/36490,https://openaccess.thecvf.com/content/CVPR2026/html/Huang_SemiGDA_Generative_Dual-distribution_Alignment_for_Semi-Supervised_Medical_Image_Segmentation_CVPR_2026_paper.html,,,,,,https://arxiv.org/abs/2604.23274,,https://openreview.net/group?id=thecvf.com/CVPR/2026/Conference,,,"Semi-supervised learning addresses label scarcity and high annotation costs in medical image segmentation by exploiting the latent information in unlabeled data to enhance model performance. Traditional discriminative segmentation relies on segmentation masks, neglecting feature-level distribution constraints. This limits robust semantic representation learning and adaptive modeling of unlabeled data in scenarios with few labels. To address these limitations, we propose SemiGDA, a novel Generative Dual-distribution Alignment framework for semi-supervised medical image segmentation. Our SemiGDA overcomes the reliance of discriminative methods on large labeled datasets by aligning feature and semantic distributions to boost semantic learning and scene adaptability. Specifically, we propose a Dual-distribution Alignment Module (DAM), which employs two structurally distinct encoders to model image and mask feature distributions. It enforces their alignment in the latent space via distributional constraints, establishing structured feature consistency. Moreover, we design a Consistency-Driven Skip Adapter (CDSA) strategy, which introduces dual skip adapters (Image and Mask) to fuse multi-scale features via skip connections. Using a consistency loss, CDSA enhances cross-branch semantic alignment and reinforces fine-grained semantic consistency.Experimental results on diverse medical datasets show that our method outperforms other state-of-the-art semi-supervised segmentation methods."
39472,Similarity-as-Evidence: Calibrating Overconfident VLMs for Interpretable and Label-Efficient Medical Active Learning,Medical AI / General,Medical AI / General,,Medical VLM / VQA / Reasoning,Zhuofan Xie; Zishan Lin; Jinliang Lin; Jie Qi; Shaohua Hong; Shuo Li,Poster Session 3 & Exhibit Hall,https://cvpr.thecvf.com/virtual/2026/poster/39472,https://openaccess.thecvf.com/content/CVPR2026/html/Xie_Similarity-as-Evidence_Calibrating_Overconfident_VLMs_for_Interpretable_and_Label-Efficient_Medical_Active_CVPR_2026_paper.html,,,,,https://www.youtube-nocookie.com/embed/SGuLA9Qa1uI,https://arxiv.org/abs/2602.18867,,https://openreview.net/group?id=thecvf.com/CVPR/2026/Conference,https://cvpr.thecvf.com/media/PosterPDFs/CVPR%202026/39472.png,https://cvpr.thecvf.com/media/PosterPDFs/CVPR%202026/39472-thumb.png,"Active Learning (AL) reduces annotation costs in medical imaging by selecting only the most informative samples for labeling, but suffers from cold-start when labeled data are scarce. Vision-Language Models (VLMs) address the cold-start problem via zero-shot predictions, yet their temperature-scaled softmax outputs treat text-image similarities as deterministic scores while ignoring inherent uncertainty, leading to overconfidence. This overconfidence misleads sample selection, wasting annotation budgets on uninformative cases. To overcome these limitations, the Similarity-as-Evidence (SaE) framework calibrates text–image similarities by introducing a Similarity Evidence Head (SEH), which reinterprets the similarity vector as evidence and parameterizes a Dirichlet distribution over labels. In contrast to a standard softmax that enforces confident predictions even under weak signals, the Dirichlet formulation explicitly quantifies lack of evidence (vacuity) and conflicting evidence (dissonance), thereby mitigating overconfidence caused by rigid softmax normalization. Building on this, SaE employs a dual-factor acquisition strategy: high-vacuity samples (e.g., rare diseases) are prioritized in early rounds to ensure coverage, while high-dissonance samples (e.g., ambiguous diagnoses) are prioritized later to refine boundaries, providing clinically interpretable selection rationales. Experiments on ten public medical imaging datasets with a 20% label budget show that SaE attains state-of-the-art macro-averaged accuracy of 82.57%. On the representative BTMRI dataset, SaE also achieves superior calibration, with a negative log-likelihood (NLL) of 0.425."
39154,Simple Agents Outperform Experts in Biomedical Imaging Workflow Optimization,Medical AI / General,Medical AI / General,,Foundation / Adaptation,Xuefei Wang; Kai A. Horstmann; Ethan Lin; Jonathan Chen; Alexander Farhang; Sophia Stiles; Atharva Sehgal; Jonathan Light; David Valen; Yisong Yue; Jennifer J. Sun,Poster Session 2 & Exhibit Hall w/ Coffee Break,https://cvpr.thecvf.com/virtual/2026/poster/39154,https://openaccess.thecvf.com/content/CVPR2026/html/Wang_Simple_Agents_Outperform_Experts_in_Biomedical_Imaging_Workflow_Optimization_CVPR_2026_paper.html,,,https://xuefei-wang.github.io/simple-agent-opt/,,https://www.youtube-nocookie.com/embed/1Q7TvvpnRw4,https://arxiv.org/abs/2512.06006,https://cvpr.thecvf.com/media/cvpr-2026/Slides/39154.pdf,https://openreview.net/group?id=thecvf.com/CVPR/2026/Conference,,,"Adapting production-level computer vision tools to bespoke scientific datasets is a critical ''last mile'' bottleneck. Current solutions are impractical: fine-tuning requires large annotated datasets scientists often lack, while manual code adaptation costs scientists weeks to months of effort. We consider using AI agents to automate this manual coding, and focus on the open question of optimal agent design for this targeted task. We introduce a systematic evaluation framework for agentic code optimization and use it to study three production-level biomedical imaging pipelines. We demonstrate that a simple agent framework consistently generates adaptation code that outperforms human-expert solutions. Our analysis reveals that common, complex agent architectures are not universally beneficial, leading to a practical roadmap for agent design. We open source our framework and validate our approach by deploying agent-generated functions into a production pipeline, demonstrating a clear pathway for real-world impact."
37453,Simple-ViLMedSAM: Simple Text Prompts Meet Vision-Language Models for Medical Image Segmentation,Medical AI / General,Medical AI / General,Organs / Anatomy,Segmentation; Medical VLM / VQA / Reasoning,Chengcan Qian; Dong Nie; Geng Chen; Daoqiang Zhang; Xuyun Wen,Poster Session 5 & Exhibit Hall,https://cvpr.thecvf.com/virtual/2026/poster/37453,https://openaccess.thecvf.com/content/CVPR2026/html/Qian_Simple-ViLMedSAM_Simple_Text_Prompts_Meet_Vision-Language_Models_for_Medical_Image_CVPR_2026_paper.html,,,,,,,,https://openreview.net/group?id=thecvf.com/CVPR/2026/Conference,https://cvpr.thecvf.com/media/PosterPDFs/CVPR%202026/37453.png,https://cvpr.thecvf.com/media/PosterPDFs/CVPR%202026/37453-thumb.png,"Medical image segmentation is challenging due to limited annotated data, high labeling costs, and substantial image heterogeneity. Although large-scale vision foundation models (e.g., SAM) have shown great potential in this field, existing SAM-based methods typically rely on expert-defined geometric prompts or complex clinical text prompts, which limits their generalizability across diverse medical image segmentation tasks. To overcome these challenges, we propose Simple-ViLMedSAM, a CLIP-SAM integration framework that enables high-accuracy segmentation in zero-shot and few-shot settings using only simple text queries, that is, using only basic anatomical or disease-related text labels. At its core is an Implicit Pos-Prompter (IPP), which generates attribution maps containing implicit positional cues to replace traditional geometric prompts. IPP incorporates a multi-modal information bottleneck and an affinity-based refinement strategy to ensure high-quality guidance from CLIP-SAM interactions. To further enhance segmentation, we introduce a Bidirectional Interaction Decoder (BID) that employs bidirectional cross-attention to align IPP’s positional maps with SAM's pixel-level features. By jointly modeling global semantics and local details, BID significantly improves segmentation accuracy. Extensive experiments on four public datasets demonstrate that Simple-ViLMedSAM consistently outperforms existing methods in both zero-shot and few-shot medical image segmentation tasks, using only simple text queries. The code will be publicly available upon acceptance."
38642,Sparse Spectral LoRA: Routed Experts for Medical VLMs,Medical AI / General,Medical AI / General,,Medical VLM / VQA / Reasoning; Foundation / Adaptation; Generative / Diffusion; Federated / Continual / Generalization,Omid Nejatimanzari; Hojat Asgariandehkordi; Taha Koleilat; Yiming Xiao; Hassan Rivaz,Poster Session 5 & Exhibit Hall,https://cvpr.thecvf.com/virtual/2026/poster/38642,https://openaccess.thecvf.com/content/CVPR2026/html/Nejatimanzari_Sparse_Spectral_LoRA_Routed_Experts_for_Medical_VLMs_CVPR_2026_paper.html,,,,,https://www.youtube-nocookie.com/embed/Ohj06KwiGRs,,,https://openreview.net/group?id=thecvf.com/CVPR/2026/Conference,https://cvpr.thecvf.com/media/PosterPDFs/CVPR%202026/38642.png,https://cvpr.thecvf.com/media/PosterPDFs/CVPR%202026/38642-thumb.png,"Large vision–language models (VLMs) excel on general benchmarks but often lack robustness in medical imaging, where heterogeneous supervision induces cross-dataset interference and sensitivity to data regime (i.e., how the supervisory signals are mixed).  In realistic clinical workflows, data and tasks arrive sequentially, so naive continual training further leads to catastrophic forgetting. To address these challenges, we propose MedQwen, a parameter-efficient medical VLM that couples a spectrally routed Mixture-of-Experts (MoE) with a theoretically grounded scaling rule that aligns low-rank updates with a full-rank, fully fine-tuned MoE, without changing the base architecture. Concretely, we initialize each expert from non-overlapping singular value decomposition (SVD) segments of the pretrained weight and introduce a residual compensation and scaling scheme to enable stable expert specialization and consistent routing under distribution shift.Across 23 medical datasets covering visual question answering, report generation, radiology classification, and hallucination mitigation, MedQwen achieves strong, reliable performance: it approaches full fine-tuning on zero-shot classification with 339$\times$ fewer trainable parameters, and reduces sequential forgetting to $\sim$5\% where strong baselines degrade by $>$20–50\%."
